,"Менеджер: Хартова Диана Игоревна
Email: diana@megamind.ru
Телефон: 
",,,Цена считается с НДС и учитывает стоимость доставки до Москвы или ТК,,"Срок тиража ""под ключ"" включает в себя: 
производство, доставку по Китаю, обработку груза, доставку с Китая до Москвы, таможню",,,
Фото,Наименование,Описание,"Тираж, шт",Цена за шт. ($.):,Цена за шт. (руб.):,Срок тиража,Образец ,Срок образца,Доп. фото
,Мини-робот,"Материал: палстик
Упаковка: фабричная коробка, пластиковый ложемент
В комплекте: провод для зарядки устройства, зарядная станция, встроенная карта памяти 16 гб, инструкция (английский язык)
Имеется приложение (доступен русский язык)
Функционал: умеет передвигаться по дому на колесиках, следить за заданным объектом, снимать фото и видео, оповещать о событиях, записывать и воспроизводить голос

Кастом: невозможен",100,"164,53","14 760,94 ₽",32-37 календ. дн.,15700,2-3 календ. дн. фото+видео + 10-12 календ. дн. доставка,
,Шубер,"Материал: бумага с семенами растений
Размер: 14,5*22*12см (в размер коробки)

Кастом: запечатка по макету клиента(нужно уточнять у фабрики, цена может разниться)",100,"5,78","514,83",28-33 календ. дн.,5300,3 календ. дн. фото+видео + 10-12 календ. дн. доставка,
