,"Менеджер: Вязовский Иван
Email: ivan@megamind.ru
Телефон: 
",,,,"Цена указана с НДС и учитывает стоимость доставки до Москвы или ТК
Срок тиража ""под ключ"" включает в себя: 
производство, доставку по Китаю, обработку груза, доставку из Китая до Москвы, таможню",,,,,,Образец не включен в стоимость тиража,,,
Фото,Наименование,Характеристики,Кастом,"Тираж, шт",Доставка ЖД,,,Доставка АВИА,,,Образец,,,Доп. фото
,,,,,"Цена за шт., $","Цена за шт., руб","Срок тиража, к.д.","Цена за шт., $","Цена за шт., руб","Срок тиража, к.д.","Цена за шт., руб","Срок фото и видео, к.д.","Срок с доставкой, к.д.",
 ,ежедневник,"Ежедневник недатированный на пружине. Формат 150х210 мм. (без учета размера пружины). Блок 100 листов. В том числе 2 листа (4 страницы) индивидуального макета, 98 – одинаковые. Во всем блоке печать 2+2 (пантон 412 серый + пантон 3435С зеленый), бумага 80 г. Офсет. Обложка и подложка переплетные крышки, основа – переплетный картон 1,75 мм. Лицевой лайнер 5+0 (смик + пантон золото 871 С) Оборотный лайнер 1+0 (пантон зеленый 3435) Софт тач ламинация на обоих лайнерах 1+0, бумага 170 г. мелованная. Пружина по длинной стороне бронза 3/4 шаг 2:1. Индивидуальная упаковка в пленку с термоусадкой.", Дизайн: по тз,7000,"3,5","300,8",50-55,"4,7","399,0",40-45,9 000,7,17-19,
,ежедневник,"Ежедневник недатированный на пружине. Формат 150х210 мм. (без учета размера пружины). Блок 100 листов, одинаковые. Печать 1+1 (пантон – 4515С, с прозрачностью 40%), бумага 80 г. офсет. Обложка и подложка переплетные крышки, основа – переплетный картон 1,75 мм. Лицевой лайнер пантон 871C. Оборотный лайнер пантон 871C. Софт тач ламинация на обоих лайнерах 1+0, бумага 170 г. мелованная. Пружина по длинной стороне бронза 3/4 шаг 2:1. Индивидуальная упаковка в пленку с термоусадкой.", Дизайн: по тз,2000,"4,1","346,0",50-55,"5,2","444,2",40-45,9 000,7,17-19,
,ежедневник,"Размер: 180х225мм (в сложенном виде) Формат блока: 170 x 220 мм. Описание обложки: Обложка выполнена методом каширования двух кожзаменителей через кожкартон черного цвета, толщиной 0,4мм. Обложка гибкая. На верхней и нижней переплетной крышке имеются прорези полукругом для резинки. На нижней крышке 2 круглых отверстия под фиксацию резинки. Концы резинки обжаты металлическими концевиками. Обложка прошита по периметру. Обложка: снаружи - кожзаменитель SlimWave 3607 (черный) / внутри – кожзаменитель Latte 33102 (темно-серый) Строчка: черная Индивидуализация: блинтовое тиснение в 1-м месте Блок: индивидуальный 240 стр., первые 4 полосы информационные, далее все страницы одинаковые, печать: 2+2. Бумага блока: Офсетная белая 80гр/м2 Вставки рекламные: При необходимости рассчитывается индивидуально Крепление блока: спираль металлическая, цвет серебро матовое. Декоративный элемент: вертикальная резинка круглая диаметром 2,5мм, цвет черный Упаковка – индивидуальная термоусадка или индивидуальный прозрачный пакет с клапаном, далее упаковка в небольшие гофрокороба.", Дизайн: по тз,3000,"6,3","533,5",50-55,"8,1","686,1",40-45,9 000,7,17-19,
,ежедневник,"Размер: 150х210мм (в сложенном виде) Формат блока: 140 x 205мм. Описание обложки: Обложка выполнена методом каширования двух кожзаменителей через кожкартон черного цвета, толщиной 0,4мм. Обложка гибкая. На верхней и нижней переплетной крышке имеются прорези полукругом для резинки. На нижней крышке 2 круглых отверстия под фиксацию резинки. Концы резинки обжаты металлическими концевиками. Обложка прошита по периметру. Обложка: снаружи - кожзаменитель Alpha3 на выбор, либо аналог (Цвет золото)/ внутри – кожзаменитель Alpha3 на выбор, либо аналог (Цвет бежевый) Строчка: На выбор Индивидуализация: блинтовое тиснение в 1-м месте Блок: индивидуальный 240 стр., страницы одинаковые, печать: 1+1. Бумага блока: Офсетная белая 80гр/м2 Вставки рекламные: При необходимости рассчитывается индивидуально Крепление блока: спираль металлическая, цвет золото. Декоративный элемент: вертикальная резинка круглая диаметром 2,5мм, в цвет наружного материала. Упаковка – индивидуальная термоусадка или индивидуальный прозрачный пакет с клапаном, далее упаковка в небольшие гофрокороба.", Дизайн: по тз,1000,"4,9","416,8",50-55,"6,4","540,8",40-45,9 000,7,17-19,
