,"Менеджер: Червоненко Светлана
Email: sveta.ch@megamind.ru
Телефон: 
",,,,,Цена считается с НДС и учитывает стоимость доставки до Москвы или ТК,,,"Срок тиража ""под ключ"" включает в себя: 
производство, доставку по Китаю, обработку груза, доставку с Китая до Москвы, таможню",,,
Фото,Наименование,Описание,"Тираж, шт",Цена за шт. ЖД ($.):,Цена за шт. ЖД (руб.):,Цена за шт. Авиа ($.):,Цена за шт. Авиа (руб.):,Срок тиража ЖД,Срок тиража Авиа,Образец,Срок образца,Доп. фото
,Пижама-кигуруми ,"Взрослая пижама кигуруми по индивидуальному дизайну
Материал: флис, с добавлением вышивки
Ростовка: 168-178 см
Индивидуальная упаковка в ваккуумный пластиковый пакет",300,"32,4","2960,0","35,5","3245,2",32-37,22-27,12600,19-22,
,Пижама-кигуруми ,"Детская пижама кигуруми по индивидуальному дизайну
Материал: флис, с добавлением вышивки
Ростовка: 130-140 см
Индивидуальная упаковка в ваккуумный пластиковый пакет",300,"24,6","2253,8","26,9","2458,4",32-37,22-27,12600,19-22,
