,"Менеджер: Побединский Георгий
Email: georgp@megamind.ru
Телефон: 
",,,Цена считается с НДС и учитывает стоимость доставки до Москвы или ТК,,"Срок тиража ""под ключ"" включает в себя: 
производство, доставку по Китаю, обработку груза, доставку с Китая до Москвы, таможню",,,
Фото,Наименование,Описание,"Тираж, шт",Цена за шт. ($.):,Цена за шт. (руб.):,Срок тиража,Образец ,Срок образца,Доп. фото
,Значок,"Размер: 60х28 мм
Материал: бронза, литье, горячая эмаль
Крепление: винт
Основа: ""цвета золота"" сквозной ромб, покрытый ювелирной горячей белой эмалью
Накладные элементы: на ромб наложен выгнутый ""цвета золота"" четырехлучевой крест, покрытый ювелирной горячей синей эмалью

В верхней части креста под орлом находится небольшой ""цвета золота"" круглый венок из лавровых ветвей
На верхнем углу ромба расположен ""цвета золото"" двуглавый орел с хвостом, лежащим на ромбе.",1700,"3,1","296,10 ₽",45-50 кд,"19221,7",21-23 кд,
