,"Менеджер: 
Email: 
Телефон: ",,"Куницына Ольга
olga.k@megamind.ru
+7 (911) 087-57-14",,"Цена указана с НДС и учитывает стоимость доставки до Москвы или ТК
Срок тиража ""под ключ"" включает в себя: 
производство, доставку по Китаю, обработку груза, доставку из Китая до Москвы, таможню",,,,,,,,Образец не включен в стоимость тиража,,,
Фото,Наименование,Характеристики,Кастом,"Тираж, шт",Доставка до Москвы авиа и потом из Москвы в Казахстан,,,,"Доставка в Казахстан и растамаживает клиент (CIP)
 таможенные пошлины не включены, возможные разрешительные документы не включены",,,,Образец в Москву,,,Доп. фото
,,,,,"Цена за шт., $","Цена за шт., руб","Итого, 
руб","Срок тиража, к.д.","Цена за шт., $","Цена за шт., руб","Итого, 
руб","Срок тиража, к.д.","Цена за шт., руб","Срок фото и видео, к.д.","Срок с доставкой, к.д.",
 ,Рукав для стаканчиков,"Материал: гофрированный картон, крафт
Размер: на стакан 0,3 L
Упаковка: без индивидуальной упаковки
", Дизайн: цифровая печать,5000,"0,26","25,73",128 650,55-60,"0,24","20,96",104 800,40-45,"7,100",7,17-19,
 ,Рукав для стаканчиков,"Материал: силикон, гладкая форма (не ребристый)
Размер: на стакан 0,3 L
Упаковка: без индивидуальной упаковки

Стоимость оринтеревочная, окончательная после макетов и изготовления образца", Дизайн: настройка формы и термоперенос,5000,"3,72","326,48",1 632 400,75-80,"3,64","313,25",1 566 250,60-65,"22,000",15,25-27,