,"Менеджер: Вязовский Иван
Email: ivan@megamind.ru
Телефон: 
",,,Цена считается с НДС и учитывает стоимость доставки до Москвы или ТК,,"Срок тиража ""под ключ"" включает в себя: 
производство, доставку по Китаю, обработку груза, доставку с Китая до Москвы, таможню",,,
Фото,Наименование,Описание,"Тираж, шт",Цена за шт. ($.):,Цена за шт. (руб.):,Срок тиража,Образец ,Срок образца,Доп. фото
,поясная сумка,"Цвет изделия: Черный, 2 отделения. Параметры изделия: Высота 15-15,5 см, ширина 30-32 см, глубина 10 см, длина ремешка 111 см. Состав: Прочный хлопковый текстиль с терилентом., оксфорд. Подклад внутри сумки – Черный. Брендирование – пиктограммы, AZIMUT TEAM на ремне, и силиконовый шарик с лого. Молния- Черная. Бегунок для молнии –Черный шнурок. Упаковка каждого изделия в прозр п\э пакет.",3350,"6,5","595,9",45-50,13000,19 дней (фото / видео 7 дней),
,поясная сумка,"Цвет изделия: Красный, 2 отделения. Параметры изделия: Высота 15-15,5 см, ширина 30-32 см, глубина 10 см, длина ремешка 111 см. Состав: Прочный хлопковый текстиль с терилентом., оксфорд. Подклад внутри сумки – Красный. Брендирование – пиктограммы, AZIMUT TEAM на ремне, и силиконовый шарик с лого. Молния- Красная. Бегунок для молнии –Красный шнурок. Упаковка каждого изделия в прозр п\э пакет",3350,"6,5","595,9",45-50,13000,19 дней (фото / видео 7 дней),
